image_name,display_name,website_link,location,tags,short_description
blank.jpg,Rob Hogan Creates,https://robhogan.me,Dealer’s Den 1,Dealers Den,I AM A LITTLE TEAPOT AND I AM FULL OF BEES AND IF YOU TIP ME OVER BEES WILL POUR OUT.
blank.jpg,Boozy Badger,https://linktr.ee/boozybadger,Dealer’s Den Performer Table,Dealers Den || Performer Table,Song & dance man/comedic performer/Law Talker. Kentucky Colonel. Host of Boozy’s Legal Funhouse podcast. He/Him. Not your lawyer.
blank.jpg,Status Ferret,http://neverssl.com,Dealer’s Den Performer Table,Dealers Den || Performer Table,I AM A LITTLE TEAPOT AND I AM FULL OF BEES AND IF YOU TIP ME OVER BEES WILL POUR OUT.
blank.jpg,Zenophrenic,https://zenophrenic.carrd.co/,Night Market 1,Night Market || Artwork (Originals / Prints / Commissions),"Monster, Vore, Ovi, and more! If you want to get weird I want to draw it for you :)"
matchapeaches.png,Matchapeaches Art,https://www.matchapeaches.art,Dealer’s Den 5,Dealers Den,I AM A LITTLE TEAPOT AND I AM FULL OF BEES AND IF YOU TIP ME OVER BEES WILL POUR OUT.
citrine-logo2.jpg,Citrine,https://www.youtube.com/user/RebaRox10,Dealer’s Den Performer Table,Dealers Den || Performer Table,"Citrine husky is the fandoms blind singing husky.. with nearly 20 albums of music there is something for everyone. Prices for CDs are $10 each, the forever pass is $200 and is a one-time price that gets you music for life. Feel free to take a personally brailed business card."
aa-1.jpg,Alkali Anonymous,https://alkalianonymous.com,Dealer’s Den Performer Table,Dealers Den || Performer Table,Chicago-based furry streamer & podcaster. Comedic & surrealist content at your fingertips! Or foot tips... if you like that sort of thing.
statiik-logo.png,STATIIK ART LLC,https://statiik.bigcartel.com/,Night Market 2,Night Market || Artwork (Originals / Prints / Commissions),"Hey, I'm a local NSFW artist! I take pride in developing a diverse portfolio, meaning I draw all body types, species, gender expressions, and more. Also, I draw pinups, group illustrations, and comics! My merch includes prints, tins, sprays, stickers, hats, shirts, and pins!"
otter-chaos-logo.png,Otter Chaos,https://twitter.com/OtterChaosVGM,Dealer’s Den Performer Table,Dealers Den || Performer Table,"Otter Chaos! is a collective of furry performers and arrangers of video game music! They combine jazz improv with classic video game tunes from games like Mario, Zelda, Sonic, and Pokémon. The result is a uniquely chaotic show featuring an eclectic group of instruments. You can listen to their past performances at youtube.com/@OtterChaosVGM or click this card to go to their twitter."
pepper-logo.jpg,Pepper,https://peppercoyote.bandcamp.com/,Dealer’s Den Performer Table,Dealers Den || Performer Table,"CDs, Vinyl records, Cassettes, and more, all full of original furry music!"
Color-1 - Olivia Lien.jpg,Papaya Badger,https://papayabadger.com,Dealer’s Den 11,Dealers Den || Artwork (Originals / Prints / Commissions),"Papaya Badger is a vector artist that makes enamel pins, tote bags, blankets, and consent badges. Please feel free to stop by and write a good bye letter or draw Milo at the TFOTR memorial table along side Papaya's."
kaiju-cafe-logo.jpg,Kaiju Kafe,https://kaijukafe.carrd.co/,Dealer’s Den 12,Dealers Den || Artwork (Originals / Prints / Commissions),Hi I'm SIN and I draw beefy monsters and write zines. My style is a mix of if Bara and Vaperwave lol.
Com_LogoSmilodon - Serathin Sabertooth.jpg,Smilodon Studio,https://www.smilodonstudio.com/,Dealer’s Den 13,Dealers Den || Artwork (Originals / Prints / Commissions),"Books galore, most with a fantasy or sci-fi theme. Both adult and clean titles available. Also selling the Void Protocol comic series, prints from the comic, and resin sculptures as well as candles with over twenty different scents!"
logo - Lindsey Burcar.jpg,"Lindsey ""Rhos"" Burcar Art",https://www.etsy.com/shop/TheWyvernsTrove,Dealer’s Den 14,Dealers Den || Artwork (Originals / Prints / Commissions),"Hi I'm Lindsey/Rhos! I am an independent artist inspired by all things fantasy and nature. I illustrate both realistic and stylized depictions of creatures and characters in natural and imaginary landscapes. I'm also big D&D nerd, and have art related to my streamed TTRPG group, Dorks in Danger! I sell's my work as prints, on play mats, mouse pads, pins, stickers, canvas prints, and together with my wife also sell handmade tote and dice bags! I will be taking a very limited number of sketchbook commissions this convention, and have a particular interest in D&D and fantasy themed characters. www.LindseyBurcar.com lindsey.burcar@gmail.com etsy.com/shop/TheWyvernsTrove"
IMG_0407 - Laura Pearson.jpg,Quack Quack Honk Designs,https://www.quackquackhonk.com,Dealer’s Den 15,Dealers Den || Artwork (Originals / Prints / Commissions),"I draw and color whimsical art of animals with food and/or drinks. Get a cool original, buy a print, acquire a sticker, and/or commission something unique to you."
TM Logo - Triangle Manor.jpg,Triangle Manor,https://linktr.ee/trianglemanor,Dealer’s Den 16,Dealers Den ,"Triangle Manor is a Queer Furry, screen printing art collective based out of the Boston, MA area. We plan to have HAND PRINTED empowering & queer shirts, masks, stickers, punk patches, and custom clothing commissions at the table!"
GD 2019 Portrait ICON - Golden Druid.jpg,Golden Druid,http://goldendruid.com/,Dealer’s Den 17,Dealers Den || Artwork (Originals / Prints / Commissions),"For nearly 20 years, GoldenDruid has worked as a professional artist. She creates her work digitally and has it available in the format of prints, stickers, shirts, and other merch. A small handful of commissions will be available at con as well.  Be sure to also check out her Ultimate Badge Lanyards, you know, the one's you see at all the cons now with the multiple built in clips to hold all your badges? Those!"
Inkmaven_2021_Banner-1 - Emily D.jpg,Inkmaven Art,https://www.inkmavenart.com/,Dealer’s Den 18,Dealers Den || Artwork (Originals / Prints / Commissions),"Ink is a digital and traditional artist who focuses on color, dynamism, and narrative in their art. Find ""acceptably furry"" apparel for every day wear as well as custom commissions and prints at her table. "
Mokos_Makery_F2_Logo.png,Moko's Makery,https://www.mokosmakery.com/,Dealer’s Den 19,Dealers Den,"Moko's Makery offers hand painted resin figures, custom fursona plushes, both digital and traditional badge commissions, and an array of merchandise such as totebags, keychains, lanyards, and much more! We also have a unique garapon game that we're excited for you to try!"
Pawgyle icon 3 - Harrison Q.jpg,Pawgyle,https://pawgyle.carrd.co/,Dealer’s Den 20,Dealers Den || Artwork (Originals / Prints / Commissions),"Step right up to see our circus-themed marvels, kidcore wonders, cottagecore dreams, nostalgia-core gems, and cute animal products to make your heart skip a beat. We offer custom commissions, cute trinkets and prints! "
FConline - Oli Owle.jpg,Sweet Cream Arts,https://www.instagram.com/sweetcreamarts/,Dealer’s Den 21,Dealers Den,"A team that enjoys making furry-related products including signs, pins, bags, scarves, shirts and more."
Screenshots_2023-10-21-10-42-35 - Spooky Sniper.jpg,The Spooky Sniper,https://thespookysniper.wixsite.com/commission,Dealer’s Den 22,Dealers Den,"Your spooky spot for handmade goodies, charms, unique monstrous designs and unforgettable vibes. Be Alarming."
Logo malmseyy - Tapioca.jpg,Malmseyy,https://malmseyy.com/,Dealer’s Den 23,Dealers Den,"Malmseyy is a brand based around cute mascots, with a hit of cursed."
CherryBoxBrandLogo.jpg,"CherryBox Media, LLC",https://cherryb0x.com,Dealer’s Den 24,Dealers Den,"Since 2010, we have been making some great art and merch for the fandom. Some stuff to look great as both con-wear and streetwear."
Postcard Pack In Back (4x6) - Blair Ondrla.jpg,CHAOS COSTUMES LLC,https://chaoscostumes.store/,Dealer’s Den 25,Dealers Den,"I primarily create resin casted and 3D printed sculptures. I specialize in accessories such as horns, hooves and paws. The horns are modular and can be worn with a human head or a fursuit head. I also sell 3D printed fursuit head bases and looking to expand to anthro ball jointed dolls."
Color 2 - Baby Blue (B.B.).jpg,B.B.'s Art Boutique,https://twitter.com/bbsartboutique,Dealer’s Den 26,Dealers Den || Artwork (Originals / Prints / Commissions),B.B. sells live drawn commissions and unique custom convention badges! He'll turn your sona into a trading card! All his badges include NFC chips for easy scanning for your social media while mingling at the con! Check him out everywhere @bbsartboutique!
logocolor_copy_1467x1462 - Liz Bie.jpg,Lizbie Cafe,https://lizbiecafe2.carrd.co/,Dealer’s Den 27,Dealers Den || Artwork (Originals / Prints / Commissions),"Lizbie Cafe is a small shop that specializes in creating enamel pins, keychains, standees, stationery, bags, and other unique items all focused around nostalgia, adorable animals, and comfort food."
CryTime SMD Stacked smaller - Sophia DeFelice.jpg,CryTime,https://crytime.art/,Dealer’s Den 28,Dealers Den || Artwork (Originals / Prints / Commissions),"CryTime is an all-encompassing shop of critter themed art and art products by Sophia DeFelice! CryTime has a mix of manufactured and handmade goods. We sell risograph prints, silk-screen prints, silk-screen patches, stickers, magnets, playing cards, pouches, enamel pins, and other various products."
fursewna-logo.png,Fursewna Studios,http://www.fursewnastudios.com/,Dealer’s Den 29,Dealers Den,"Fursewna Studios specializes in unique fursuit builds that stretch the imagination. Our studio loves to create one-of-a-kind creatures, both cute and creepy. Our booth offers premade fursuits typically themed to the convention as well as stickers, enamel pins, plush props, fursuit construction pieces and more! We also offer services for custom onesie pajamas, fursuits and plush goods. So come on down and take a look at all the fantastic wares and wonders that await!"
maim reynard husky in a box FULL - D. Maim.jpg,Maimface,https://www.instagram.com/maimface/,Dealer’s Den 30,Dealers Den,Fursuits and fursuit DIY supplies by Maim and ReynardHusky
Fenris Logo Md - Rex Fenris.jpg,"Fenris Publishing, LLC",https://www.fenrispublishing.com/order.php,Dealer’s Den 31,Dealers Den,"Fenris Publishing distributes and publishes hundreds of books, comics, art collections, and tabletop games, along with a variety of associated accessories and merchandise. We are the new owners of Rabbit Valley Comics and we partner with a variety of other publishers and independent creators."
Color-1 - Mio.jpg,LakeMutt,https://lake-mutt.com/,Dealer’s Den 32,Dealers Den,"Heya! We’re LakeMutt! An indigenous ran business! We love to make cute designs around nature & from our home state, Minnesota! You’ll find lots of cute shirts, button ups, charms, stickers & more! We also do at con badges!"
Toonfox banner logo 600 - Brian Reynolds.jpg,Brian Reynolds,https://www.furaffinity.net/user/toonfx/,Dealer’s Den 33,Dealers Den || Artwork (Originals / Prints / Commissions),"My name is Brian Reynolds and I'm a professional cartoonist / animator with experience working in Slot Machines, Children's Educational Software, and handheld consoles. My experience dealing at conventions runs back to 1998 when Anthrocon was held in Albany, NY. I specialize in lively, exuberant, personality-rich cartoon character renders. I love to entertain folks with my work and I strive to make each of my efforts a ""performance"" of sorts where I make your character feel alive and vibrant. I bring to my table a large collection of original art, prints, stickers, lanyards, and FUN. I look forward to interacting with everyone who visits my table and sharing my enthusiasm for art and drawing!"
About Us Labels - FeretStudios.jpg,FeretStudios,https://feretstudios.wixsite.com/feretstudios,Dealer’s Den 34,Dealers Den || Artwork (Originals / Prints / Commissions),"Hello! My name is Izabela and I am a Polish traditional artist that specializes in traditional inkwork and pattern work; with excellent attention to detail and designs. Most recently I have also picked up digital coloring and color theory, using it as a mixed media with all my traditional works. I have a large selections of prints, both 11x17 and 8x10, that I will be selling at the convention, along with stickers, enamel pins, and bookmarks. I also have been selling large blankets and mousepads with my artwork on it. I love taking traditional commissions and badges, that are full on inkwork and colored in with copic markers. I enjoy drawing animals, nature and my Polish culture!"
DaSueDragon-Designs-Banner-2023-Label-Banner-SMALL - Sue Maple.jpg,DaSueDragon Designs,https://dasuedragon.com/pages/furry-gallery,Dealer’s Den 35,Dealers Den,"DaSueDragon Designs is devoted to hand-crafting the highest quality leather works. We specialize in bags, claws, and various leather cosplay, fursuit leather hybrid partials and furry accessories including custom metal furry badges! Design and customization are our specialty!"
300x600 px talenshi listing for dealer pages - Karen Swartz.jpg,Talenshi Studios,https://www.talenshistudios.com/,Dealer’s Den 36,Dealers Den,"Karen/ Talenshi is an illustrator with a love of birds, fantasy, and all things textural and tactile. Justin is a scientist with skills in coding and engineering, who also loves animals and making useful physical objects. Together we invented our refillable magnetic journal system, and we love creating things that bring magic to everyday life. We are also creating the Birds at Arms Project together. Come see our magnetic journals & sketchbooks, hand-crafted enchanted (light-up) flower pins, whimsical resin printed creatures that come with paints and brushes, funny wooden signs and prints of Talenshi's fantastical bird illustrations."
Wooperworks-300x600-Logo - Sara Jensen.jpg,Wooperworks,https://www.furaffinity.net/gallery/rikkoshaye/,Dealer’s Den 37,Dealers Den || Artwork (Originals / Prints / Commissions),"Wooper will be offering traditional commissions completed at-con (including sushi badges, boba tea badges, taco badges, and googly-eye badges), prints, stickers, buttons, pins, acrylic keychains, mugs, and t-shirts. Common themes include cute animals, sushi, Pokemon, and Egyptian mythology"
business cards - Brianna.jpg,Plant Panda Studios,https://linktr.ee/Plantpanda,Dealer’s Den 38,Dealers Den || Artwork (Originals / Prints / Commissions),"We, here at Plant Panda Studios, cater to a wide variety of customers from the plant lovers, to the pool toy and plush scenes, we even cater to the SFW Abdl scene by creating a friendly plant themed display we sprouted and grew in 2020. Our artwork includes cute animals, plants, various fandoms, and the occasional bug or two. We offer a wide range of products including the following: Dakis, Sticker books, Standees, magnets, lanyards, keychains, pins, buttons, commissions, and much much more."
IMG_4366 - Hudson Deer.jpg,Deer Hudson Crafts,https://deerhudsoncrafts.carrd.co/,Dealer’s Den 39,Dealers Den || Artwork (Originals / Prints / Commissions),"Deer Hudson Crafts offers soft, sleepy, and moody artworks appealing to a sense of cosmic connection and reverence for all things “un alive” as well as forms of life other than our own. Their work focuses on expression of “difficult to name” emotions. Check out DeerHudsonCrafts.carrd.co for more details, online storefront links, and contact information!"
IMG_20180617_044250_712 - Eddie Fox.jpg,Craft Fox Boutique,https://www.craftfoxboutique.com,Dealer’s Den 40,Dealers Den,"We specialize in Fragrance products that are hand made at reasonable prices! From Pursuit Sprays to fans, you can't go wrong with out selection! Even after a day of suiting you can get some soap and light a candle all at the same place!"
HOODIEDOGS_LOGO_2023 - January Bridges.jpg,hoodiedogs,https://twitter.com/hoodiedogs_,Dealer’s Den 41,Dealers Den || Artwork (Originals / Prints / Commissions),"I am an artist and designer who has been doodling around the furry community for over ten years now! My main specialty is traditional art in the form of watercolor, colored pencil and gouache, and I really love offering at-con commissions for badges and the like. I will also be bringing my large catalogue of stickers, postcards, screen-printed merchandise and much more!"
pbanner - Josh.jpg,Joshiah's Written Works,https://twitter.com/The_Joshiah,Dealer’s Den 42,Dealers Den,"Joshiah's Written Works is here to spice up your night life! Whether you're looking for a steamy romance or a kinky classic, we've got the words to get the job done."
cosmik-and-rhubarb.jpg,RHUBARB & COSMIK,https://www.facebook.com/TheRealCosmik/,Dealer’s Den Performer Table,Dealers Den || Performer Table,"Rhubarb the Bear and Cosmik are both professional musicians who enjoy sharing their talents with the fandom.  They’re not sure how they got so famous, but they’ve been inside Firr’s dome house, so they must be pretty up there.  They don’t have much to sell, but they’ll happily sing you a song and say “Howdy!”"
IMG_20231018_170638_518 - Sema.jpg,Lycantasy,www.lycantasy.com,Night Market 3,Night Market,"At this trans-owned adult toy company, we've conjured a world of Cryptid-themed creations. Our designs embrace inclusivity and accessibility that transform fantasies into tangible experiences for all. All our toys are meticulously and locally handcrafted!"
Frontbleed - Elizabeth Appel.jpg,Regally Wild,https://regallywild.com/,Night Market 4,Night Market,"Handmade vegan leather alternative apparel ranging from collars and chokers to harness and belts. Our materials are designed for comfort and durability. Waterproof, odor resistant, and easy to maintain! "
mom icon purple - Nick G.jpg,Monstrous On Main,https://www.monstrousonmain.com/,Night Market 5,Night Market,"Monstrous On Main boasts 30+ unique body pillow designs of monster & furry characters, as well as themed buttons & keychains, art prints, & creature-inspired face masks. Commission inquiries welcome."
F2 Small 2 - Vellum F_.jpg,Wolfen Creations - Artwork of Vellum,https://www.furaffinity.net/user/vellum/,Night Market 6,Night Market,"Vellum offers a variety of merchandise such as stickers, prints, originals, T-shirts, and more. There are also limited availabilities of at-con sketch commissions!"
Aromatic Hyena Twitter - Wandering Artist.jpg,Aromatic Creations,https://www.aromaticcreations.club/,Night Market 7,Night Market || Artwork (Originals / Prints / Commissions),I make NSFW art and animations of musky and sweaty furries!
logolarge - Glitzy Fox Studios (Glitzy).jpg,Glitzy Fox Studios,https://glitzyfoxstudios.com/,Dealer’s Den 49,Dealers Den,We work with furry artists around the world to bring an amazing selection of Dakimakuras/ Body Pillows and prints.
logo 3 - Simple Nick's (SimpleNick's).jpg,Simple Nick's,https://simplenicks.com/pages/,Dealer’s Den 50,Dealers Den,for every convention we typically bring: 3 fursuit partials (themed to match convention or holiday usually) 6 shirt designs (all are dyed and printed in our shop) several cross body bags and mot recently we offer cheap fursuit glasses (7 color options) and plush fursuit collars ( also in rainbow.)
sparkle-kreations-logo.jpg,Sparkle Kreations,https://www.sparklekreations.com/,Dealer’s Den 51,Dealers Den,"""Fantastically Fluffy"" Tails, Fursuits, Props, and more! We have all varieties of furry, avian, scaled, and other species, too!! We have other fun stuff like handpaws and shirts, too. Check out our webstore for more tail options available to purchase after the con; and information regarding custom commissions for fursuits and more is on our website."
pleasefeedbear-logo.png,Please Feed The Bear,https://www.pleasefeedthebear.com,Night Market 23,Night Market,"HI I'M CANDY!! An artist in the fandom for 15 years, I make tons of stickers, pins, prints and other little things as well as custom badges and digital art commissions. I excel mostly in my more adult artwork. :3c Come say hi!"
